Tamil Nadu,Marina Beach Chennai,Comfort Inn & Suites near Marina Beach Chennai,3.8,4,Yes,No,80.2824,13.05,Economy Family Room,2027
Tamil Nadu,Kanyakumari,The Grand Kanyakumari Resort & Spa,4.8,2,Yes,Yes,77.5385,8.0883,Deluxe King Suite,8867
Tamil Nadu,Kanyakumari,Kanyakumari Heritage View Hotel,4.2,3,Yes,Yes,77.5385,8.0883,Standard Premium Double,4474
Tamil Nadu,Kanyakumari,Comfort Inn & Suites near Kanyakumari,3.7,4,No,No,77.5385,8.0883,Economy Family Room,1042
Tamil Nadu,Madurai,The Grand Madurai Resort & Spa,4.6,2,Yes,Yes,78.1198,9.9252,Deluxe King Suite,12216
Tamil Nadu,Madurai,Madurai Heritage View Hotel,3.9,3,Yes,Yes,78.1198,9.9252,Standard Premium Double,5078
Tamil Nadu,Madurai,Comfort Inn & Suites near Madurai,3.8,4,Yes,No,78.1198,9.9252,Economy Family Room,1280
Tamil Nadu,Mudumalai National Park,The Grand Mudumalai National Park Resort & Spa,4.6,2,Yes,Yes,76.6367,11.5717,Deluxe King Suite,7933
Tamil Nadu,Mudumalai National Park,Mudumalai National Park Heritage View Hotel,4.3,3,Yes,No,76.6367,11.5717,Standard Premium Double,4274
Tamil Nadu,Mudumalai National Park,Comfort Inn & Suites near Mudumalai National Park,3.5,4,Yes,No,76.6367,11.5717,Economy Family Room,1280
Tamil Nadu,Vellore Fort,The Grand Vellore Fort Resort & Spa,4.8,2,Yes,Yes,79.1319,12.9202,Deluxe King Suite,13225
Tamil Nadu,Vellore Fort,Vellore Fort Heritage View Hotel,4.2,3,Yes,Yes,79.1319,12.9202,Standard Premium Double,3914
Tamil Nadu,Vellore Fort,Comfort Inn & Suites near Vellore Fort,3.3,4,No,No,79.1319,12.9202,Economy Family Room,1266
Himachal Pradesh,Shimla,The Grand Shimla Resort & Spa,4.9,2,Yes,Yes,77.1734,31.1048,Deluxe King Suite,11007
Himachal Pradesh,Shimla,Shimla Heritage View Hotel,4.2,3,Yes,Yes,77.1734,31.1048,Standard Premium Double,3960
Himachal Pradesh,Shimla,Comfort Inn & Suites near Shimla,3.4,4,Yes,No,77.1734,31.1048,Economy Family Room,1621
Himachal Pradesh,Manali,The Grand Manali Resort & Spa,4.8,2,Yes,Yes,77.1892,32.2432,Deluxe King Suite,9379
Himachal Pradesh,Manali,Manali Heritage View Hotel,4.4,3,Yes,No,77.1892,32.2432,Standard Premium Double,2521
Himachal Pradesh,Manali,Comfort Inn & Suites near Manali,3.4,4,Yes,No,77.1892,32.2432,Economy Family Room,1260
Himachal Pradesh,Rohtang Pass,The Grand Rohtang Pass Resort & Spa,4.8,2,Yes,Yes,77.2453,32.3726,Deluxe King Suite,7179
Himachal Pradesh,Rohtang Pass,Rohtang Pass Heritage View Hotel,4.3,3,Yes,Yes,77.2453,32.3726,Standard Premium Double,3547
Himachal Pradesh,Rohtang Pass,Comfort Inn & Suites near Rohtang Pass,3.5,4,No,No,77.2453,32.3726,Economy Family Room,2028
Himachal Pradesh,Spiti Valley,The Grand Spiti Valley Resort & Spa,4.7,2,Yes,Yes,78.0335,32.2464,Deluxe King Suite,8273
Himachal Pradesh,Spiti Valley,Spiti Valley Heritage View Hotel,4.1,3,Yes,No,78.0335,32.2464,Standard Premium Double,5307
Himachal Pradesh,Spiti Valley,Comfort Inn & Suites near Spiti Valley,3.4,4,Yes,No,78.0335,32.2464,Economy Family Room,1815
Himachal Pradesh,Dharamshala,The Grand Dharamshala Resort & Spa,4.5,2,Yes,Yes,76.3234,32.219,Deluxe King Suite,9860
Himachal Pradesh,Dharamshala,Dharamshala Heritage View Hotel,4.2,3,Yes,No,76.3234,32.219,Standard Premium Double,3639
Himachal Pradesh,Dharamshala,Comfort Inn & Suites near Dharamshala,3.5,4,No,No,76.3234,32.219,Economy Family Room,1937
Himachal Pradesh,Dalhousie,The Grand Dalhousie Resort & Spa,4.9,2,Yes,Yes,75.9731,32.5382,Deluxe King Suite,13356
Himachal Pradesh,Dalhousie,Dalhousie Heritage View Hotel,4.2,3,Yes,No,75.9731,32.5382,Standard Premium Double,2682
Himachal Pradesh,Dalhousie,Comfort Inn & Suites near Dalhousie,3.3,4,Yes,No,75.9731,32.5382,Economy Family Room,1644
Himachal Pradesh,Kullu Valley,The Grand Kullu Valley Resort & Spa,4.6,2,Yes,Yes,77.1089,31.9592,Deluxe King Suite,13593
Himachal Pradesh,Kullu Valley,Kullu Valley Heritage View Hotel,4.2,3,Yes,No,77.1089,31.9592,Standard Premium Double,2813
Himachal Pradesh,Kullu Valley,Comfort Inn & Suites near Kullu Valley,3.5,4,Yes,No,77.1089,31.9592,Economy Family Room,2141
Himachal Pradesh,Kasol,The Grand Kasol Resort & Spa,4.7,2,Yes,Yes,77.3149,32.0098,Deluxe King Suite,10454
Himachal Pradesh,Kasol,Kasol Heritage View Hotel,4.3,3,Yes,No,77.3149,32.0098,Standard Premium Double,4016
Himachal Pradesh,Kasol,Comfort Inn & Suites near Kasol,3.2,4,Yes,No,77.3149,32.0098,Economy Family Room,1426
Himachal Pradesh,Khajjiar,The Grand Khajjiar Resort & Spa,4.8,2,Yes,Yes,76.0531,32.5424,Deluxe King Suite,9085
Himachal Pradesh,Khajjiar,Khajjiar Heritage View Hotel,4.3,3,Yes,Yes,76.0531,32.5424,Standard Premium Double,5426
Himachal Pradesh,Khajjiar,Comfort Inn & Suites near Khajjiar,3.7,4,Yes,No,76.0531,32.5424,Economy Family Room,1357
Himachal Pradesh,Great Himalayan National Park,The Grand Great Himalayan National Park Resort & Spa,4.6,2,Yes,Yes,77.488,31.748,Deluxe King Suite,6754
Himachal Pradesh,Great Himalayan National Park,Great Himalayan National Park Heritage View Hotel,4.3,3,Yes,No,77.488,31.748,Standard Premium Double,4021
Himachal Pradesh,Great Himalayan National Park,Comfort Inn & Suites near Great Himalayan National Park,3.5,4,Yes,No,77.488,31.748,Economy Family Room,956
West Bengal,Victoria Memorial Kolkata,The Grand Victoria Memorial Kolkata Resort & Spa,4.6,2,Yes,Yes,88.3426,22.5448,Deluxe King Suite,10941
West Bengal,Victoria Memorial Kolkata,Victoria Memorial Kolkata Heritage View Hotel,4.1,3,Yes,Yes,88.3426,22.5448,Standard Premium Double,4716
West Bengal,Victoria Memorial Kolkata,Comfort Inn & Suites near Victoria Memorial Kolkata,3.3,4,Yes,No,88.3426,22.5448,Economy Family Room,1415
West Bengal,Darjeeling Tea Estates,The Grand Darjeeling Tea Estates Resort & Spa,4.5,2,Yes,Yes,88.2627,27.036,Deluxe King Suite,8910
West Bengal,Darjeeling Tea Estates,Darjeeling Tea Estates Heritage View Hotel,4.2,3,Yes,Yes,88.2627,27.036,Standard Premium Double,3839
West Bengal,Darjeeling Tea Estates,Comfort Inn & Suites near Darjeeling Tea Estates,3.6,4,No,No,88.2627,27.036,Economy Family Room,1594
West Bengal,Sundarbans National Park,The Grand Sundarbans National Park Resort & Spa,4.6,2,Yes,Yes,89.1833,21.9497,Deluxe King Suite,14174
West Bengal,Sundarbans National Park,Sundarbans National Park Heritage View Hotel,3.9,3,Yes,Yes,89.1833,21.9497,Standard Premium Double,3447
West Bengal,Sundarbans National Park,Comfort Inn & Suites near Sundarbans National Park,3.6,4,Yes,No,89.1833,21.9497,Economy Family Room,2153
West Bengal,Howrah Bridge,The Grand Howrah Bridge Resort & Spa,4.7,2,Yes,Yes,88.3468,22.5851,Deluxe King Suite,6891
West Bengal,Howrah Bridge,Howrah Bridge Heritage View Hotel,4.3,3,Yes,Yes,88.3468,22.5851,Standard Premium Double,4268
West Bengal,Howrah Bridge,Comfort Inn & Suites near Howrah Bridge,3.6,4,No,No,88.3468,22.5851,Economy Family Room,1554
West Bengal,Dakshineswar Kali Temple,The Grand Dakshineswar Kali Temple Resort & Spa,4.9,2,Yes,Yes,88.358,22.6545,Deluxe King Suite,10087
West Bengal,Dakshineswar Kali Temple,Dakshineswar Kali Temple Heritage View Hotel,4.0,3,Yes,Yes,88.358,22.6545,Standard Premium Double,4889
West Bengal,Dakshineswar Kali Temple,Comfort Inn & Suites near Dakshineswar Kali Temple,3.5,4,No,No,88.358,22.6545,Economy Family Room,1088
West Bengal,Bishnupur Temples,The Grand Bishnupur Temples Resort & Spa,4.7,2,Yes,Yes,87.3155,23.0773,Deluxe King Suite,9028
West Bengal,Bishnupur Temples,Bishnupur Temples Heritage View Hotel,4.4,3,Yes,Yes,87.3155,23.0773,Standard Premium Double,3343
West Bengal,Bishnupur Temples,Comfort Inn & Suites near Bishnupur Temples,3.4,4,No,No,87.3155,23.0773,Economy Family Room,2095
West Bengal,Tiger Hill Darjeeling,The Grand Tiger Hill Darjeeling Resort & Spa,4.8,2,Yes,Yes,88.2985,27.0173,Deluxe King Suite,13971
West Bengal,Tiger Hill Darjeeling,Tiger Hill Darjeeling Heritage View Hotel,3.9,3,Yes,No,88.2985,27.0173,Standard Premium Double,3880
West Bengal,Tiger Hill Darjeeling,Comfort Inn & Suites near Tiger Hill Darjeeling,3.6,4,No,No,88.2985,27.0173,Economy Family Room,2117
West Bengal,Belur Math,The Grand Belur Math Resort & Spa,4.6,2,Yes,Yes,88.3568,22.6292,Deluxe King Suite,14642
West Bengal,Belur Math,Belur Math Heritage View Hotel,4.0,3,Yes,No,88.3568,22.6292,Standard Premium Double,5028
West Bengal,Belur Math,Comfort Inn & Suites near Belur Math,3.7,4,Yes,No,88.3568,22.6292,Economy Family Room,1277
West Bengal,Indian Museum Kolkata,The Grand Indian Museum Kolkata Resort & Spa,4.6,2,Yes,Yes,88.3512,22.557,Deluxe King Suite,10582
West Bengal,Indian Museum Kolkata,Indian Museum Kolkata Heritage View Hotel,4.3,3,Yes,Yes,88.3512,22.557,Standard Premium Double,4670
West Bengal,Indian Museum Kolkata,Comfort Inn & Suites near Indian Museum Kolkata,3.6,4,No,No,88.3512,22.557,Economy Family Room,1364
West Bengal,Murshidabad,The Grand Murshidabad Resort & Spa,4.5,2,Yes,Yes,88.2697,24.1834,Deluxe King Suite,11750
West Bengal,Murshidabad,Murshidabad Heritage View Hotel,4.3,3,Yes,Yes,88.2697,24.1834,Standard Premium Double,5082
West Bengal,Murshidabad,Comfort Inn & Suites near Murshidabad,3.6,4,No,No,88.2697,24.1834,Economy Family Room,1441
New South Wales,Sydney Opera House,The Grand Sydney Opera House Resort & Spa,4.8,2,Yes,Yes,151.2153,-33.8568,Deluxe King Suite,416
New South Wales,Sydney Opera House,Sydney Opera House Heritage View Hotel,4.4,3,Yes,No,151.2153,-33.8568,Standard Premium Double,129
New South Wales,Sydney Opera House,Comfort Inn & Suites near Sydney Opera House,3.6,4,Yes,No,151.2153,-33.8568,Economy Family Room,88
New South Wales,Sydney Harbour Bridge,The Grand Sydney Harbour Bridge Resort & Spa,4.8,2,Yes,Yes,151.2108,-33.8523,Deluxe King Suite,316
New South Wales,Sydney Harbour Bridge,Sydney Harbour Bridge Heritage View Hotel,4.3,3,Yes,No,151.2108,-33.8523,Standard Premium Double,175
New South Wales,Sydney Harbour Bridge,Comfort Inn & Suites near Sydney Harbour Bridge,3.2,4,No,No,151.2108,-33.8523,Economy Family Room,67
New South Wales,Bondi Beach,The Grand Bondi Beach Resort & Spa,4.8,2,Yes,Yes,151.2767,-33.8915,Deluxe King Suite,323
New South Wales,Bondi Beach,Bondi Beach Heritage View Hotel,4.1,3,Yes,Yes,151.2767,-33.8915,Standard Premium Double,206
New South Wales,Bondi Beach,Comfort Inn & Suites near Bondi Beach,3.6,4,Yes,No,151.2767,-33.8915,Economy Family Room,92
New South Wales,Blue Mountains,The Grand Blue Mountains Resort & Spa,4.5,2,Yes,Yes,150.3117,-33.7148,Deluxe King Suite,288
New South Wales,Blue Mountains,Blue Mountains Heritage View Hotel,4.4,3,Yes,No,150.3117,-33.7148,Standard Premium Double,192
New South Wales,Blue Mountains,Comfort Inn & Suites near Blue Mountains,3.5,4,No,No,150.3117,-33.7148,Economy Family Room,79
New South Wales,Royal Botanic Garden Sydney,The Grand Royal Botanic Garden Sydney Resort & Spa,4.7,2,Yes,Yes,151.2166,-33.8642,Deluxe King Suite,313
New South Wales,Royal Botanic Garden Sydney,Royal Botanic Garden Sydney Heritage View Hotel,4.1,3,Yes,No,151.2166,-33.8642,Standard Premium Double,167
New South Wales,Royal Botanic Garden Sydney,Comfort Inn & Suites near Royal Botanic Garden Sydney,3.5,4,No,No,151.2166,-33.8642,Economy Family Room,76
New South Wales,Hunter Valley Wineries,The Grand Hunter Valley Wineries Resort & Spa,4.5,2,Yes,Yes,151.17,-32.79,Deluxe King Suite,364
New South Wales,Hunter Valley Wineries,Hunter Valley Wineries Heritage View Hotel,4.0,3,Yes,No,151.17,-32.79,Standard Premium Double,163
New South Wales,Hunter Valley Wineries,Comfort Inn & Suites near Hunter Valley Wineries,3.6,4,Yes,No,151.17,-32.79,Economy Family Room,80
New South Wales,Byron Bay,The Grand Byron Bay Resort & Spa,4.7,2,Yes,Yes,153.602,-28.6474,Deluxe King Suite,293
New South Wales,Byron Bay,Byron Bay Heritage View Hotel,4.0,3,Yes,No,153.602,-28.6474,Standard Premium Double,149
New South Wales,Byron Bay,Comfort Inn & Suites near Byron Bay,3.6,4,No,No,153.602,-28.6474,Economy Family Room,67
New South Wales,Jervis Bay,The Grand Jervis Bay Resort & Spa,4.6,2,Yes,Yes,150.76,-35.17,Deluxe King Suite,443
New South Wales,Jervis Bay,Jervis Bay Heritage View Hotel,4.3,3,Yes,Yes,150.76,-35.17,Standard Premium Double,178
New South Wales,Jervis Bay,Comfort Inn & Suites near Jervis Bay,3.4,4,No,No,150.76,-35.17,Economy Family Room,97
New South Wales,Port Stephens,The Grand Port Stephens Resort & Spa,4.6,2,Yes,Yes,152.091,-32.717,Deluxe King Suite,378
New South Wales,Port Stephens,Port Stephens Heritage View Hotel,4.2,3,Yes,No,152.091,-32.717,Standard Premium Double,125
New South Wales,Port Stephens,Comfort Inn & Suites near Port Stephens,3.4,4,Yes,No,152.091,-32.717,Economy Family Room,76
New South Wales,Snowy Mountains,The Grand Snowy Mountains Resort & Spa,4.8,2,Yes,Yes,148.264,-36.4548,Deluxe King Suite,430
New South Wales,Snowy Mountains,Snowy Mountains Heritage View Hotel,4.1,3,Yes,Yes,148.264,-36.4548,Standard Premium Double,182
New South Wales,Snowy Mountains,Comfort Inn & Suites near Snowy Mountains,3.6,4,No,No,148.264,-36.4548,Economy Family Room,104
Victoria,Great Ocean Road,The Grand Great Ocean Road Resort & Spa,4.9,2,Yes,Yes,143.4,-38.68,Deluxe King Suite,323
Victoria,Great Ocean Road,Great Ocean Road Heritage View Hotel,4.4,3,Yes,No,143.4,-38.68,Standard Premium Double,181
Victoria,Great Ocean Road,Comfort Inn & Suites near Great Ocean Road,3.6,4,No,No,143.4,-38.68,Economy Family Room,78
Victoria,Twelve Apostles,The Grand Twelve Apostles Resort & Spa,4.7,2,Yes,Yes,143.105,-38.6623,Deluxe King Suite,499
Victoria,Twelve Apostles,Twelve Apostles Heritage View Hotel,4.4,3,Yes,Yes,143.105,-38.6623,Standard Premium Double,190
Victoria,Twelve Apostles,Comfort Inn & Suites near Twelve Apostles,3.3,4,Yes,No,143.105,-38.6623,Economy Family Room,101
Victoria,Federation Square Melbourne,The Grand Federation Square Melbourne Resort & Spa,4.6,2,Yes,Yes,144.9691,-37.818,Deluxe King Suite,473
Victoria,Federation Square Melbourne,Federation Square Melbourne Heritage View Hotel,4.2,3,Yes,Yes,144.9691,-37.818,Standard Premium Double,185
Victoria,Federation Square Melbourne,Comfort Inn & Suites near Federation Square Melbourne,3.4,4,Yes,No,144.9691,-37.818,Economy Family Room,97
Victoria,Phillip Island Penguin Parade,The Grand Phillip Island Penguin Parade Resort & Spa,4.6,2,Yes,Yes,145.3677,-38.4987,Deluxe King Suite,360
Victoria,Phillip Island Penguin Parade,Phillip Island Penguin Parade Heritage View Hotel,3.9,3,Yes,No,145.3677,-38.4987,Standard Premium Double,139
Victoria,Phillip Island Penguin Parade,Comfort Inn & Suites near Phillip Island Penguin Parade,3.5,4,No,No,145.3677,-38.4987,Economy Family Room,92
Victoria,Yarra Valley,The Grand Yarra Valley Resort & Spa,4.7,2,Yes,Yes,145.55,-37.71,Deluxe King Suite,317
Victoria,Yarra Valley,Yarra Valley Heritage View Hotel,4.0,3,Yes,Yes,145.55,-37.71,Standard Premium Double,194
Victoria,Yarra Valley,Comfort Inn & Suites near Yarra Valley,3.3,4,Yes,No,145.55,-37.71,Economy Family Room,73
Victoria,Melbourne Cricket Ground,The Grand Melbourne Cricket Ground Resort & Spa,4.5,2,Yes,Yes,144.9836,-37.82,Deluxe King Suite,312
Victoria,Melbourne Cricket Ground,Melbourne Cricket Ground Heritage View Hotel,4.1,3,Yes,No,144.9836,-37.82,Standard Premium Double,156
Victoria,Melbourne Cricket Ground,Comfort Inn & Suites near Melbourne Cricket Ground,3.5,4,No,No,144.9836,-37.82,Economy Family Room,84
Victoria,Sovereign Hill Ballarat,The Grand Sovereign Hill Ballarat Resort & Spa,4.7,2,Yes,Yes,143.8397,-37.5683,Deluxe King Suite,306
Victoria,Sovereign Hill Ballarat,Sovereign Hill Ballarat Heritage View Hotel,4.1,3,Yes,Yes,143.8397,-37.5683,Standard Premium Double,153
Victoria,Sovereign Hill Ballarat,Comfort Inn & Suites near Sovereign Hill Ballarat,3.7,4,Yes,No,143.8397,-37.5683,Economy Family Room,67
Victoria,Healesville Sanctuary,The Grand Healesville Sanctuary Resort & Spa,4.8,2,Yes,Yes,145.5163,-37.6561,Deluxe King Suite,275
Victoria,Healesville Sanctuary,Healesville Sanctuary Heritage View Hotel,4.2,3,Yes,No,145.5163,-37.6561,Standard Premium Double,199
Victoria,Healesville Sanctuary,Comfort Inn & Suites near Healesville Sanctuary,3.6,4,No,No,145.5163,-37.6561,Economy Family Room,98
Victoria,Wilson's Promontory,The Grand Wilson's Promontory Resort & Spa,4.9,2,Yes,Yes,146.35,-39.05,Deluxe King Suite,366
Victoria,Wilson's Promontory,Wilson's Promontory Heritage View Hotel,4.1,3,Yes,Yes,146.35,-39.05,Standard Premium Double,155
Victoria,Wilson's Promontory,Comfort Inn & Suites near Wilson's Promontory,3.4,4,Yes,No,146.35,-39.05,Economy Family Room,97
Victoria,Royal Botanic Gardens Melbourne,The Grand Royal Botanic Gardens Melbourne Resort & Spa,4.8,2,Yes,Yes,144.9798,-37.8304,Deluxe King Suite,387
Victoria,Royal Botanic Gardens Melbourne,Royal Botanic Gardens Melbourne Heritage View Hotel,4.3,3,Yes,No,144.9798,-37.8304,Standard Premium Double,200
Victoria,Royal Botanic Gardens Melbourne,Comfort Inn & Suites near Royal Botanic Gardens Melbourne,3.8,4,Yes,No,144.9798,-37.8304,Economy Family Room,98
Queensland,Great Barrier Reef,The Grand Great Barrier Reef Resort & Spa,4.9,2,Yes,Yes,147.6992,-18.2871,Deluxe King Suite,405
Queensland,Great Barrier Reef,Great Barrier Reef Heritage View Hotel,4.1,3,Yes,Yes,147.6992,-18.2871,Standard Premium Double,130
Queensland,Great Barrier Reef,Comfort Inn & Suites near Great Barrier Reef,3.5,4,Yes,No,147.6992,-18.2871,Economy Family Room,103
Queensland,Whitsunday Islands,The Grand Whitsunday Islands Resort & Spa,4.6,2,Yes,Yes,148.83,-20.27,Deluxe King Suite,472
Queensland,Whitsunday Islands,Whitsunday Islands Heritage View Hotel,4.3,3,Yes,No,148.83,-20.27,Standard Premium Double,156
Queensland,Whitsunday Islands,Comfort Inn & Suites near Whitsunday Islands,3.7,4,No,No,148.83,-20.27,Economy Family Room,97
Queensland,Daintree Rainforest,The Grand Daintree Rainforest Resort & Spa,4.5,2,Yes,Yes,145.42,-16.17,Deluxe King Suite,280
Queensland,Daintree Rainforest,Daintree Rainforest Heritage View Hotel,4.1,3,Yes,No,145.42,-16.17,Standard Premium Double,190
Queensland,Daintree Rainforest,Comfort Inn & Suites near Daintree Rainforest,3.7,4,No,No,145.42,-16.17,Economy Family Room,72
Queensland,Gold Coast,The Grand Gold Coast Resort & Spa,4.6,2,Yes,Yes,153.4,-28.0167,Deluxe King Suite,499
Queensland,Gold Coast,Gold Coast Heritage View Hotel,4.1,3,Yes,Yes,153.4,-28.0167,Standard Premium Double,166
Queensland,Gold Coast,Comfort Inn & Suites near Gold Coast,3.5,4,No,No,153.4,-28.0167,Economy Family Room,70
Queensland,Cairns,The Grand Cairns Resort & Spa,4.5,2,Yes,Yes,145.7781,-16.9186,Deluxe King Suite,337
Queensland,Cairns,Cairns Heritage View Hotel,4.1,3,Yes,No,145.7781,-16.9186,Standard Premium Double,161
Queensland,Cairns,Comfort Inn & Suites near Cairns,3.7,4,No,No,145.7781,-16.9186,Economy Family Room,69
Queensland,Noosa National Park,The Grand Noosa National Park Resort & Spa,4.5,2,Yes,Yes,153.089,-26.4003,Deluxe King Suite,366
Queensland,Noosa National Park,Noosa National Park Heritage View Hotel,3.9,3,Yes,Yes,153.089,-26.4003,Standard Premium Double,130
Queensland,Noosa National Park,Comfort Inn & Suites near Noosa National Park,3.3,4,No,No,153.089,-26.4003,Economy Family Room,100
Queensland,Lamington National Park,The Grand Lamington National Park Resort & Spa,4.6,2,Yes,Yes,153.15,-28.22,Deluxe King Suite,397
Queensland,Lamington National Park,Lamington National Park Heritage View Hotel,3.9,3,Yes,Yes,153.15,-28.22,Standard Premium Double,146
Queensland,Lamington National Park,Comfort Inn & Suites near Lamington National Park,3.5,4,Yes,No,153.15,-28.22,Economy Family Room,74
Queensland,Fraser Island,The Grand Fraser Island Resort & Spa,4.6,2,Yes,Yes,153.2,-25.25,Deluxe King Suite,479
Queensland,Fraser Island,Fraser Island Heritage View Hotel,4.3,3,Yes,Yes,153.2,-25.25,Standard Premium Double,189
Queensland,Fraser Island,Comfort Inn & Suites near Fraser Island,3.7,4,No,No,153.2,-25.25,Economy Family Room,95
Queensland,Kuranda,The Grand Kuranda Resort & Spa,4.6,2,Yes,Yes,145.6333,-16.8167,Deluxe King Suite,396
Queensland,Kuranda,Kuranda Heritage View Hotel,4.3,3,Yes,No,145.6333,-16.8167,Standard Premium Double,191
Queensland,Kuranda,Comfort Inn & Suites near Kuranda,3.4,4,No,No,145.6333,-16.8167,Economy Family Room,67
Queensland,Atherton Tablelands,The Grand Atherton Tablelands Resort & Spa,4.8,2,Yes,Yes,145.4833,-17.2667,Deluxe King Suite,370
Queensland,Atherton Tablelands,Atherton Tablelands Heritage View Hotel,4.0,3,Yes,Yes,145.4833,-17.2667,Standard Premium Double,202
Queensland,Atherton Tablelands,Comfort Inn & Suites near Atherton Tablelands,3.4,4,Yes,No,145.4833,-17.2667,Economy Family Room,77
Western Australia,Ningaloo Reef,The Grand Ningaloo Reef Resort & Spa,4.8,2,Yes,Yes,113.8,-22.6,Deluxe King Suite,311
Western Australia,Ningaloo Reef,Ningaloo Reef Heritage View Hotel,4.2,3,Yes,No,113.8,-22.6,Standard Premium Double,165
Western Australia,Ningaloo Reef,Comfort Inn & Suites near Ningaloo Reef,3.7,4,Yes,No,113.8,-22.6,Economy Family Room,74
Western Australia,Pinnacles Desert,The Grand Pinnacles Desert Resort & Spa,4.7,2,Yes,Yes,115.15,-30.6,Deluxe King Suite,448
Western Australia,Pinnacles Desert,Pinnacles Desert Heritage View Hotel,3.9,3,Yes,Yes,115.15,-30.6,Standard Premium Double,166
Western Australia,Pinnacles Desert,Comfort Inn & Suites near Pinnacles Desert,3.8,4,No,No,115.15,-30.6,Economy Family Room,65
Western Australia,Margaret River,The Grand Margaret River Resort & Spa,4.8,2,Yes,Yes,115.07,-33.95,Deluxe King Suite,392
Western Australia,Margaret River,Margaret River Heritage View Hotel,4.3,3,Yes,Yes,115.07,-33.95,Standard Premium Double,148
Western Australia,Margaret River,Comfort Inn & Suites near Margaret River,3.4,4,No,No,115.07,-33.95,Economy Family Room,72
Western Australia,Broome Cable Beach,The Grand Broome Cable Beach Resort & Spa,4.9,2,Yes,Yes,122.23,-17.96,Deluxe King Suite,419
Western Australia,Broome Cable Beach,Broome Cable Beach Heritage View Hotel,4.3,3,Yes,Yes,122.23,-17.96,Standard Premium Double,203
Western Australia,Broome Cable Beach,Comfort Inn & Suites near Broome Cable Beach,3.4,4,Yes,No,122.23,-17.96,Economy Family Room,93
Western Australia,Wave Rock,The Grand Wave Rock Resort & Spa,4.8,2,Yes,Yes,118.89,-32.44,Deluxe King Suite,345
Western Australia,Wave Rock,Wave Rock Heritage View Hotel,4.4,3,Yes,Yes,118.89,-32.44,Standard Premium Double,123
Western Australia,Wave Rock,Comfort Inn & Suites near Wave Rock,3.8,4,Yes,No,118.89,-32.44,Economy Family Room,92
Western Australia,Rottnest Island,The Grand Rottnest Island Resort & Spa,4.9,2,Yes,Yes,115.5167,-32.0067,Deluxe King Suite,283
Western Australia,Rottnest Island,Rottnest Island Heritage View Hotel,4.3,3,Yes,Yes,115.5167,-32.0067,Standard Premium Double,207
Western Australia,Rottnest Island,Comfort Inn & Suites near Rottnest Island,3.3,4,No,No,115.5167,-32.0067,Economy Family Room,73
Western Australia,Karijini National Park,The Grand Karijini National Park Resort & Spa,4.5,2,Yes,Yes,118.32,-22.46,Deluxe King Suite,490
Western Australia,Karijini National Park,Karijini National Park Heritage View Hotel,4.1,3,Yes,Yes,118.32,-22.46,Standard Premium Double,200
Western Australia,Karijini National Park,Comfort Inn & Suites near Karijini National Park,3.5,4,No,No,118.32,-22.46,Economy Family Room,93
Western Australia,Perth Kings Park,The Grand Perth Kings Park Resort & Spa,4.5,2,Yes,Yes,115.8333,-31.9567,Deluxe King Suite,412
Western Australia,Perth Kings Park,Perth Kings Park Heritage View Hotel,4.2,3,Yes,No,115.8333,-31.9567,Standard Premium Double,130
Western Australia,Perth Kings Park,Comfort Inn & Suites near Perth Kings Park,3.6,4,No,No,115.8333,-31.9567,Economy Family Room,89
Western Australia,Shark Bay,The Grand Shark Bay Resort & Spa,4.7,2,Yes,Yes,113.97,-25.99,Deluxe King Suite,481
Western Australia,Shark Bay,Shark Bay Heritage View Hotel,4.4,3,Yes,No,113.97,-25.99,Standard Premium Double,169
Western Australia,Shark Bay,Comfort Inn & Suites near Shark Bay,3.4,4,No,No,113.97,-25.99,Economy Family Room,78
Western Australia,Fremantle Prison,The Grand Fremantle Prison Resort & Spa,4.6,2,Yes,Yes,115.751,-32.0577,Deluxe King Suite,378
Western Australia,Fremantle Prison,Fremantle Prison Heritage View Hotel,4.2,3,Yes,No,115.751,-32.0577,Standard Premium Double,157
Western Australia,Fremantle Prison,Comfort Inn & Suites near Fremantle Prison,3.8,4,Yes,No,115.751,-32.0577,Economy Family Room,99
South Australia,Kangaroo Island,The Grand Kangaroo Island Resort & Spa,4.8,2,Yes,Yes,137.2,-35.77,Deluxe King Suite,490
South Australia,Kangaroo Island,Kangaroo Island Heritage View Hotel,3.9,3,Yes,No,137.2,-35.77,Standard Premium Double,190
South Australia,Kangaroo Island,Comfort Inn & Suites near Kangaroo Island,3.6,4,Yes,No,137.2,-35.77,Economy Family Room,81
South Australia,Barossa Valley,The Grand Barossa Valley Resort & Spa,4.8,2,Yes,Yes,139.0,-34.53,Deluxe King Suite,318
South Australia,Barossa Valley,Barossa Valley Heritage View Hotel,4.4,3,Yes,No,139.0,-34.53,Standard Premium Double,200
South Australia,Barossa Valley,Comfort Inn & Suites near Barossa Valley,3.5,4,No,No,139.0,-34.53,Economy Family Room,88
South Australia,Flinders Ranges,The Grand Flinders Ranges Resort & Spa,4.8,2,Yes,Yes,138.62,-31.5,Deluxe King Suite,380
South Australia,Flinders Ranges,Flinders Ranges Heritage View Hotel,4.1,3,Yes,No,138.62,-31.5,Standard Premium Double,135
South Australia,Flinders Ranges,Comfort Inn & Suites near Flinders Ranges,3.4,4,No,No,138.62,-31.5,Economy Family Room,72
South Australia,Coober Pedy,The Grand Coober Pedy Resort & Spa,4.8,2,Yes,Yes,134.7543,-29.0135,Deluxe King Suite,451
South Australia,Coober Pedy,Coober Pedy Heritage View Hotel,4.0,3,Yes,No,134.7543,-29.0135,Standard Premium Double,178
South Australia,Coober Pedy,Comfort Inn & Suites near Coober Pedy,3.2,4,Yes,No,134.7543,-29.0135,Economy Family Room,93
South Australia,Adelaide Central Market,The Grand Adelaide Central Market Resort & Spa,4.5,2,Yes,Yes,138.5986,-34.9285,Deluxe King Suite,444
South Australia,Adelaide Central Market,Adelaide Central Market Heritage View Hotel,4.3,3,Yes,No,138.5986,-34.9285,Standard Premium Double,163
South Australia,Adelaide Central Market,Comfort Inn & Suites near Adelaide Central Market,3.4,4,No,No,138.5986,-34.9285,Economy Family Room,82
