Nagano,Zenko-ji Temple,The Grand Zenko-ji Temple Resort & Spa,4.5,2,Yes,Yes,138.1893,36.666,Deluxe King Suite,47553
Nagano,Zenko-ji Temple,Zenko-ji Temple Heritage View Hotel,4.3,3,Yes,No,138.1893,36.666,Standard Premium Double,18713
Nagano,Zenko-ji Temple,Comfort Inn & Suites near Zenko-ji Temple,3.5,4,Yes,No,138.1893,36.666,Economy Family Room,6291
Nagano,Hakuba Valley,The Grand Hakuba Valley Resort & Spa,4.5,2,Yes,Yes,137.8602,36.7004,Deluxe King Suite,58218
Nagano,Hakuba Valley,Hakuba Valley Heritage View Hotel,4.0,3,Yes,Yes,137.8602,36.7004,Standard Premium Double,20951
Nagano,Hakuba Valley,Comfort Inn & Suites near Hakuba Valley,3.2,4,No,No,137.8602,36.7004,Economy Family Room,8574
Nagano,Narai-juku Post Town,The Grand Narai-juku Post Town Resort & Spa,4.6,2,Yes,Yes,137.8653,36.0278,Deluxe King Suite,59821
Nagano,Narai-juku Post Town,Narai-juku Post Town Heritage View Hotel,4.0,3,Yes,Yes,137.8653,36.0278,Standard Premium Double,19065
Nagano,Narai-juku Post Town,Comfort Inn & Suites near Narai-juku Post Town,3.5,4,No,No,137.8653,36.0278,Economy Family Room,7944
Nagano,Tateyama Kurobe,The Grand Tateyama Kurobe Resort & Spa,4.5,2,Yes,Yes,137.6076,36.5705,Deluxe King Suite,40430
Nagano,Tateyama Kurobe,Tateyama Kurobe Heritage View Hotel,4.1,3,Yes,Yes,137.6076,36.5705,Standard Premium Double,21529
Nagano,Tateyama Kurobe,Comfort Inn & Suites near Tateyama Kurobe,3.7,4,No,No,137.6076,36.5705,Economy Family Room,8239
Nagano,Togakushi Shrine,The Grand Togakushi Shrine Resort & Spa,4.7,2,Yes,Yes,137.9936,36.775,Deluxe King Suite,29732
Nagano,Togakushi Shrine,Togakushi Shrine Heritage View Hotel,4.3,3,Yes,Yes,137.9936,36.775,Standard Premium Double,15384
Nagano,Togakushi Shrine,Comfort Inn & Suites near Togakushi Shrine,3.5,4,No,No,137.9936,36.775,Economy Family Room,7032
Nagano,Suwa Lake,The Grand Suwa Lake Resort & Spa,4.5,2,Yes,Yes,138.0833,36.0478,Deluxe King Suite,42077
Nagano,Suwa Lake,Suwa Lake Heritage View Hotel,4.2,3,Yes,Yes,138.0833,36.0478,Standard Premium Double,21299
Nagano,Suwa Lake,Comfort Inn & Suites near Suwa Lake,3.5,4,No,No,138.0833,36.0478,Economy Family Room,8066
Nagano,Kiso Valley,The Grand Kiso Valley Resort & Spa,4.7,2,Yes,Yes,137.6044,35.7939,Deluxe King Suite,30391
Nagano,Kiso Valley,Kiso Valley Heritage View Hotel,4.1,3,Yes,Yes,137.6044,35.7939,Standard Premium Double,21536
Nagano,Kiso Valley,Comfort Inn & Suites near Kiso Valley,3.6,4,No,No,137.6044,35.7939,Economy Family Room,6326
Uttar Pradesh,Taj Mahal,The Grand Taj Mahal Resort & Spa,4.7,2,Yes,Yes,78.0421,27.1751,Deluxe King Suite,11646
Uttar Pradesh,Taj Mahal,Taj Mahal Heritage View Hotel,4.3,3,Yes,Yes,78.0421,27.1751,Standard Premium Double,4572
Uttar Pradesh,Taj Mahal,Comfort Inn & Suites near Taj Mahal,3.5,4,No,No,78.0421,27.1751,Economy Family Room,1237
Uttar Pradesh,Agra Fort,The Grand Agra Fort Resort & Spa,4.7,2,Yes,Yes,78.0216,27.1798,Deluxe King Suite,12091
Uttar Pradesh,Agra Fort,Agra Fort Heritage View Hotel,4.2,3,Yes,No,78.0216,27.1798,Standard Premium Double,4496
Uttar Pradesh,Agra Fort,Comfort Inn & Suites near Agra Fort,3.6,4,Yes,No,78.0216,27.1798,Economy Family Room,1884
Uttar Pradesh,Varanasi Ghats,The Grand Varanasi Ghats Resort & Spa,4.8,2,Yes,Yes,83.0062,25.3176,Deluxe King Suite,12093
Uttar Pradesh,Varanasi Ghats,Varanasi Ghats Heritage View Hotel,3.9,3,Yes,Yes,83.0062,25.3176,Standard Premium Double,4915
Uttar Pradesh,Varanasi Ghats,Comfort Inn & Suites near Varanasi Ghats,3.6,4,Yes,No,83.0062,25.3176,Economy Family Room,1933
Uttar Pradesh,Fatehpur Sikri,The Grand Fatehpur Sikri Resort & Spa,4.9,2,Yes,Yes,77.6642,27.0945,Deluxe King Suite,12221
Uttar Pradesh,Fatehpur Sikri,Fatehpur Sikri Heritage View Hotel,4.0,3,Yes,Yes,77.6642,27.0945,Standard Premium Double,4083
Uttar Pradesh,Fatehpur Sikri,Comfort Inn & Suites near Fatehpur Sikri,3.6,4,No,No,77.6642,27.0945,Economy Family Room,1731
Uttar Pradesh,Lucknow Bara Imambara,The Grand Lucknow Bara Imambara Resort & Spa,4.6,2,Yes,Yes,80.9116,26.8672,Deluxe King Suite,14816
Uttar Pradesh,Lucknow Bara Imambara,Lucknow Bara Imambara Heritage View Hotel,4.3,3,Yes,Yes,80.9116,26.8672,Standard Premium Double,3889
Uttar Pradesh,Lucknow Bara Imambara,Comfort Inn & Suites near Lucknow Bara Imambara,3.3,4,No,No,80.9116,26.8672,Economy Family Room,1647
Uttar Pradesh,Mathura,The Grand Mathura Resort & Spa,4.8,2,Yes,Yes,77.6737,27.4924,Deluxe King Suite,6660
Uttar Pradesh,Mathura,Mathura Heritage View Hotel,4.4,3,Yes,Yes,77.6737,27.4924,Standard Premium Double,5270
Uttar Pradesh,Mathura,Comfort Inn & Suites near Mathura,3.8,4,Yes,No,77.6737,27.4924,Economy Family Room,938
Uttar Pradesh,Vrindavan,The Grand Vrindavan Resort & Spa,4.8,2,Yes,Yes,77.693,27.5726,Deluxe King Suite,8644
Uttar Pradesh,Vrindavan,Vrindavan Heritage View Hotel,4.2,3,Yes,No,77.693,27.5726,Standard Premium Double,2506
Uttar Pradesh,Vrindavan,Comfort Inn & Suites near Vrindavan,3.4,4,Yes,No,77.693,27.5726,Economy Family Room,991
Uttar Pradesh,Allahabad Triveni Sangam,The Grand Allahabad Triveni Sangam Resort & Spa,4.6,2,Yes,Yes,81.8463,25.4358,Deluxe King Suite,14540
Uttar Pradesh,Allahabad Triveni Sangam,Allahabad Triveni Sangam Heritage View Hotel,4.3,3,Yes,Yes,81.8463,25.4358,Standard Premium Double,4372
Uttar Pradesh,Allahabad Triveni Sangam,Comfort Inn & Suites near Allahabad Triveni Sangam,3.5,4,Yes,No,81.8463,25.4358,Economy Family Room,1892
Uttar Pradesh,Sarnath,The Grand Sarnath Resort & Spa,4.6,2,Yes,Yes,83.0242,25.3814,Deluxe King Suite,13938
Uttar Pradesh,Sarnath,Sarnath Heritage View Hotel,4.2,3,Yes,No,83.0242,25.3814,Standard Premium Double,2996
Uttar Pradesh,Sarnath,Comfort Inn & Suites near Sarnath,3.2,4,Yes,No,83.0242,25.3814,Economy Family Room,2075
Uttar Pradesh,Dudhwa National Park,The Grand Dudhwa National Park Resort & Spa,4.8,2,Yes,Yes,80.525,28.498,Deluxe King Suite,7172
Uttar Pradesh,Dudhwa National Park,Dudhwa National Park Heritage View Hotel,4.0,3,Yes,No,80.525,28.498,Standard Premium Double,3750
Uttar Pradesh,Dudhwa National Park,Comfort Inn & Suites near Dudhwa National Park,3.4,4,Yes,No,80.525,28.498,Economy Family Room,1121
Rajasthan,Amber Fort Jaipur,The Grand Amber Fort Jaipur Resort & Spa,4.6,2,Yes,Yes,75.8513,26.9855,Deluxe King Suite,10033
Rajasthan,Amber Fort Jaipur,Amber Fort Jaipur Heritage View Hotel,4.4,3,Yes,No,75.8513,26.9855,Standard Premium Double,3125
Rajasthan,Amber Fort Jaipur,Comfort Inn & Suites near Amber Fort Jaipur,3.5,4,No,No,75.8513,26.9855,Economy Family Room,1602
Rajasthan,City Palace Udaipur,The Grand City Palace Udaipur Resort & Spa,4.7,2,Yes,Yes,73.6833,24.5763,Deluxe King Suite,7989
Rajasthan,City Palace Udaipur,City Palace Udaipur Heritage View Hotel,4.3,3,Yes,Yes,73.6833,24.5763,Standard Premium Double,2962
Rajasthan,City Palace Udaipur,Comfort Inn & Suites near City Palace Udaipur,3.7,4,No,No,73.6833,24.5763,Economy Family Room,1243
Rajasthan,Mehrangarh Fort Jodhpur,The Grand Mehrangarh Fort Jodhpur Resort & Spa,4.9,2,Yes,Yes,73.0178,26.2978,Deluxe King Suite,14656
Rajasthan,Mehrangarh Fort Jodhpur,Mehrangarh Fort Jodhpur Heritage View Hotel,4.1,3,Yes,No,73.0178,26.2978,Standard Premium Double,2837
Rajasthan,Mehrangarh Fort Jodhpur,Comfort Inn & Suites near Mehrangarh Fort Jodhpur,3.7,4,No,No,73.0178,26.2978,Economy Family Room,1934
Rajasthan,Jaisalmer Fort,The Grand Jaisalmer Fort Resort & Spa,4.6,2,Yes,Yes,70.9083,26.9157,Deluxe King Suite,11776
Rajasthan,Jaisalmer Fort,Jaisalmer Fort Heritage View Hotel,4.0,3,Yes,Yes,70.9083,26.9157,Standard Premium Double,4877
Rajasthan,Jaisalmer Fort,Comfort Inn & Suites near Jaisalmer Fort,3.6,4,Yes,No,70.9083,26.9157,Economy Family Room,1592
Rajasthan,Hawa Mahal Jaipur,The Grand Hawa Mahal Jaipur Resort & Spa,4.6,2,Yes,Yes,75.8267,26.9239,Deluxe King Suite,6596
Rajasthan,Hawa Mahal Jaipur,Hawa Mahal Jaipur Heritage View Hotel,3.9,3,Yes,Yes,75.8267,26.9239,Standard Premium Double,2562
Rajasthan,Hawa Mahal Jaipur,Comfort Inn & Suites near Hawa Mahal Jaipur,3.8,4,No,No,75.8267,26.9239,Economy Family Room,2161
Rajasthan,Pushkar Lake,The Grand Pushkar Lake Resort & Spa,4.8,2,Yes,Yes,74.5517,26.4883,Deluxe King Suite,11905
Rajasthan,Pushkar Lake,Pushkar Lake Heritage View Hotel,4.0,3,Yes,No,74.5517,26.4883,Standard Premium Double,4178
Rajasthan,Pushkar Lake,Comfort Inn & Suites near Pushkar Lake,3.8,4,Yes,No,74.5517,26.4883,Economy Family Room,1181
Rajasthan,Ranthambore National Park,The Grand Ranthambore National Park Resort & Spa,4.5,2,Yes,Yes,76.5026,26.0173,Deluxe King Suite,10581
Rajasthan,Ranthambore National Park,Ranthambore National Park Heritage View Hotel,4.0,3,Yes,Yes,76.5026,26.0173,Standard Premium Double,4299
Rajasthan,Ranthambore National Park,Comfort Inn & Suites near Ranthambore National Park,3.5,4,No,No,76.5026,26.0173,Economy Family Room,1453
Rajasthan,Chittorgarh Fort,The Grand Chittorgarh Fort Resort & Spa,4.6,2,Yes,Yes,74.6439,24.8887,Deluxe King Suite,14264
Rajasthan,Chittorgarh Fort,Chittorgarh Fort Heritage View Hotel,4.2,3,Yes,No,74.6439,24.8887,Standard Premium Double,3544
Rajasthan,Chittorgarh Fort,Comfort Inn & Suites near Chittorgarh Fort,3.7,4,Yes,No,74.6439,24.8887,Economy Family Room,1208
Rajasthan,Sam Sand Dunes,The Grand Sam Sand Dunes Resort & Spa,4.8,2,Yes,Yes,70.5421,26.8757,Deluxe King Suite,8092
Rajasthan,Sam Sand Dunes,Sam Sand Dunes Heritage View Hotel,4.1,3,Yes,No,70.5421,26.8757,Standard Premium Double,2750
Rajasthan,Sam Sand Dunes,Comfort Inn & Suites near Sam Sand Dunes,3.5,4,No,No,70.5421,26.8757,Economy Family Room,2000
Rajasthan,Kumbhalgarh Fort,The Grand Kumbhalgarh Fort Resort & Spa,4.5,2,Yes,Yes,73.587,25.1476,Deluxe King Suite,8665
Rajasthan,Kumbhalgarh Fort,Kumbhalgarh Fort Heritage View Hotel,4.0,3,Yes,No,73.587,25.1476,Standard Premium Double,2957
Rajasthan,Kumbhalgarh Fort,Comfort Inn & Suites near Kumbhalgarh Fort,3.8,4,No,No,73.587,25.1476,Economy Family Room,1385
Delhi,Red Fort,The Grand Red Fort Resort & Spa,4.7,2,Yes,Yes,77.241,28.6562,Deluxe King Suite,9344
Delhi,Red Fort,Red Fort Heritage View Hotel,4.1,3,Yes,No,77.241,28.6562,Standard Premium Double,3304
Delhi,Red Fort,Comfort Inn & Suites near Red Fort,3.6,4,Yes,No,77.241,28.6562,Economy Family Room,1009
Delhi,Qutub Minar,The Grand Qutub Minar Resort & Spa,4.9,2,Yes,Yes,77.1855,28.5245,Deluxe King Suite,14913
Delhi,Qutub Minar,Qutub Minar Heritage View Hotel,4.4,3,Yes,No,77.1855,28.5245,Standard Premium Double,5260
Delhi,Qutub Minar,Comfort Inn & Suites near Qutub Minar,3.4,4,No,No,77.1855,28.5245,Economy Family Room,1190
Delhi,India Gate,The Grand India Gate Resort & Spa,4.7,2,Yes,Yes,77.2295,28.6129,Deluxe King Suite,10874
Delhi,India Gate,India Gate Heritage View Hotel,4.3,3,Yes,No,77.2295,28.6129,Standard Premium Double,5212
Delhi,India Gate,Comfort Inn & Suites near India Gate,3.7,4,Yes,No,77.2295,28.6129,Economy Family Room,1517
Delhi,Humayun's Tomb,The Grand Humayun's Tomb Resort & Spa,4.6,2,Yes,Yes,77.2507,28.5933,Deluxe King Suite,11734
Delhi,Humayun's Tomb,Humayun's Tomb Heritage View Hotel,4.2,3,Yes,Yes,77.2507,28.5933,Standard Premium Double,5021
Delhi,Humayun's Tomb,Comfort Inn & Suites near Humayun's Tomb,3.5,4,Yes,No,77.2507,28.5933,Economy Family Room,1696
Delhi,Lotus Temple,The Grand Lotus Temple Resort & Spa,4.6,2,Yes,Yes,77.2588,28.5535,Deluxe King Suite,10535
Delhi,Lotus Temple,Lotus Temple Heritage View Hotel,4.4,3,Yes,No,77.2588,28.5535,Standard Premium Double,3813
Delhi,Lotus Temple,Comfort Inn & Suites near Lotus Temple,3.4,4,No,No,77.2588,28.5535,Economy Family Room,2189
Delhi,Akshardham Temple,The Grand Akshardham Temple Resort & Spa,4.8,2,Yes,Yes,77.2773,28.6127,Deluxe King Suite,12750
Delhi,Akshardham Temple,Akshardham Temple Heritage View Hotel,4.2,3,Yes,No,77.2773,28.6127,Standard Premium Double,4810
Delhi,Akshardham Temple,Comfort Inn & Suites near Akshardham Temple,3.4,4,Yes,No,77.2773,28.6127,Economy Family Room,1213
Delhi,Jama Masjid,The Grand Jama Masjid Resort & Spa,4.5,2,Yes,Yes,77.2334,28.6507,Deluxe King Suite,12191
Delhi,Jama Masjid,Jama Masjid Heritage View Hotel,4.3,3,Yes,No,77.2334,28.6507,Standard Premium Double,2830
Delhi,Jama Masjid,Comfort Inn & Suites near Jama Masjid,3.7,4,Yes,No,77.2334,28.6507,Economy Family Room,1306
Delhi,Chandni Chowk,The Grand Chandni Chowk Resort & Spa,4.6,2,Yes,Yes,77.23,28.658,Deluxe King Suite,7641
Delhi,Chandni Chowk,Chandni Chowk Heritage View Hotel,4.1,3,Yes,No,77.23,28.658,Standard Premium Double,4375
Delhi,Chandni Chowk,Comfort Inn & Suites near Chandni Chowk,3.6,4,No,No,77.23,28.658,Economy Family Room,913
Delhi,Lodi Garden,The Grand Lodi Garden Resort & Spa,4.5,2,Yes,Yes,77.2198,28.5931,Deluxe King Suite,12872
Delhi,Lodi Garden,Lodi Garden Heritage View Hotel,3.9,3,Yes,No,77.2198,28.5931,Standard Premium Double,5107
Delhi,Lodi Garden,Comfort Inn & Suites near Lodi Garden,3.3,4,No,No,77.2198,28.5931,Economy Family Room,1425
Delhi,National Museum New Delhi,The Grand National Museum New Delhi Resort & Spa,4.8,2,Yes,Yes,77.2198,28.6116,Deluxe King Suite,9719
Delhi,National Museum New Delhi,National Museum New Delhi Heritage View Hotel,4.3,3,Yes,No,77.2198,28.6116,Standard Premium Double,5090
Delhi,National Museum New Delhi,Comfort Inn & Suites near National Museum New Delhi,3.2,4,Yes,No,77.2198,28.6116,Economy Family Room,1889
Kerala,Backwaters Alleppey,The Grand Backwaters Alleppey Resort & Spa,4.7,2,Yes,Yes,76.3388,9.4981,Deluxe King Suite,7358
Kerala,Backwaters Alleppey,Backwaters Alleppey Heritage View Hotel,4.0,3,Yes,Yes,76.3388,9.4981,Standard Premium Double,4435
Kerala,Backwaters Alleppey,Comfort Inn & Suites near Backwaters Alleppey,3.5,4,No,No,76.3388,9.4981,Economy Family Room,1341
Kerala,Munnar Tea Gardens,The Grand Munnar Tea Gardens Resort & Spa,4.5,2,Yes,Yes,77.0595,10.0889,Deluxe King Suite,7354
Kerala,Munnar Tea Gardens,Munnar Tea Gardens Heritage View Hotel,4.0,3,Yes,No,77.0595,10.0889,Standard Premium Double,4942
Kerala,Munnar Tea Gardens,Comfort Inn & Suites near Munnar Tea Gardens,3.3,4,No,No,77.0595,10.0889,Economy Family Room,1278
Kerala,Periyar Wildlife Sanctuary,The Grand Periyar Wildlife Sanctuary Resort & Spa,4.8,2,Yes,Yes,77.204,9.4639,Deluxe King Suite,9890
Kerala,Periyar Wildlife Sanctuary,Periyar Wildlife Sanctuary Heritage View Hotel,4.3,3,Yes,No,77.204,9.4639,Standard Premium Double,5248
Kerala,Periyar Wildlife Sanctuary,Comfort Inn & Suites near Periyar Wildlife Sanctuary,3.6,4,Yes,No,77.204,9.4639,Economy Family Room,1420
Kerala,Fort Kochi,The Grand Fort Kochi Resort & Spa,4.6,2,Yes,Yes,76.2429,9.9639,Deluxe King Suite,8601
Kerala,Fort Kochi,Fort Kochi Heritage View Hotel,4.4,3,Yes,Yes,76.2429,9.9639,Standard Premium Double,3488
Kerala,Fort Kochi,Comfort Inn & Suites near Fort Kochi,3.2,4,No,No,76.2429,9.9639,Economy Family Room,1555
Kerala,Varkala Cliff Beach,The Grand Varkala Cliff Beach Resort & Spa,4.8,2,Yes,Yes,76.7163,8.7379,Deluxe King Suite,14104
Kerala,Varkala Cliff Beach,Varkala Cliff Beach Heritage View Hotel,4.3,3,Yes,No,76.7163,8.7379,Standard Premium Double,4264
Kerala,Varkala Cliff Beach,Comfort Inn & Suites near Varkala Cliff Beach,3.4,4,No,No,76.7163,8.7379,Economy Family Room,2195
Kerala,Thekkady,The Grand Thekkady Resort & Spa,4.9,2,Yes,Yes,77.1621,9.5993,Deluxe King Suite,9193
Kerala,Thekkady,Thekkady Heritage View Hotel,4.3,3,Yes,Yes,77.1621,9.5993,Standard Premium Double,3218
Kerala,Thekkady,Comfort Inn & Suites near Thekkady,3.3,4,No,No,77.1621,9.5993,Economy Family Room,2011
Kerala,Wayanad,The Grand Wayanad Resort & Spa,4.6,2,Yes,Yes,76.132,11.6854,Deluxe King Suite,10708
Kerala,Wayanad,Wayanad Heritage View Hotel,4.4,3,Yes,Yes,76.132,11.6854,Standard Premium Double,5033
Kerala,Wayanad,Comfort Inn & Suites near Wayanad,3.4,4,Yes,No,76.132,11.6854,Economy Family Room,1883
Kerala,Athirapally Falls,The Grand Athirapally Falls Resort & Spa,4.7,2,Yes,Yes,76.5705,10.2853,Deluxe King Suite,9118
Kerala,Athirapally Falls,Athirapally Falls Heritage View Hotel,4.3,3,Yes,No,76.5705,10.2853,Standard Premium Double,3084
Kerala,Athirapally Falls,Comfort Inn & Suites near Athirapally Falls,3.3,4,No,No,76.5705,10.2853,Economy Family Room,1885
Kerala,Kovalam Beach,The Grand Kovalam Beach Resort & Spa,4.9,2,Yes,Yes,76.9784,8.3988,Deluxe King Suite,7945
Kerala,Kovalam Beach,Kovalam Beach Heritage View Hotel,4.0,3,Yes,Yes,76.9784,8.3988,Standard Premium Double,4626
Kerala,Kovalam Beach,Comfort Inn & Suites near Kovalam Beach,3.5,4,Yes,No,76.9784,8.3988,Economy Family Room,1741
Kerala,Silent Valley National Park,The Grand Silent Valley National Park Resort & Spa,4.8,2,Yes,Yes,76.459,11.0753,Deluxe King Suite,13048
Kerala,Silent Valley National Park,Silent Valley National Park Heritage View Hotel,4.0,3,Yes,No,76.459,11.0753,Standard Premium Double,3105
Kerala,Silent Valley National Park,Comfort Inn & Suites near Silent Valley National Park,3.4,4,No,No,76.459,11.0753,Economy Family Room,1925
Goa,Baga Beach,The Grand Baga Beach Resort & Spa,4.7,2,Yes,Yes,73.7521,15.5561,Deluxe King Suite,11290
Goa,Baga Beach,Baga Beach Heritage View Hotel,4.3,3,Yes,No,73.7521,15.5561,Standard Premium Double,2773
Goa,Baga Beach,Comfort Inn & Suites near Baga Beach,3.7,4,Yes,No,73.7521,15.5561,Economy Family Room,2028
Goa,Basilica of Bom Jesus,The Grand Basilica of Bom Jesus Resort & Spa,4.8,2,Yes,Yes,73.9116,15.5008,Deluxe King Suite,9896
Goa,Basilica of Bom Jesus,Basilica of Bom Jesus Heritage View Hotel,4.4,3,Yes,No,73.9116,15.5008,Standard Premium Double,3719
Goa,Basilica of Bom Jesus,Comfort Inn & Suites near Basilica of Bom Jesus,3.2,4,Yes,No,73.9116,15.5008,Economy Family Room,1313
Goa,Dudhsagar Falls,The Grand Dudhsagar Falls Resort & Spa,4.9,2,Yes,Yes,74.314,15.3143,Deluxe King Suite,14711
Goa,Dudhsagar Falls,Dudhsagar Falls Heritage View Hotel,3.9,3,Yes,Yes,74.314,15.3143,Standard Premium Double,4765
Goa,Dudhsagar Falls,Comfort Inn & Suites near Dudhsagar Falls,3.2,4,Yes,No,74.314,15.3143,Economy Family Room,955
Goa,Anjuna Beach,The Grand Anjuna Beach Resort & Spa,4.7,2,Yes,Yes,73.744,15.5739,Deluxe King Suite,10714
Goa,Anjuna Beach,Anjuna Beach Heritage View Hotel,4.3,3,Yes,Yes,73.744,15.5739,Standard Premium Double,3087
Goa,Anjuna Beach,Comfort Inn & Suites near Anjuna Beach,3.5,4,No,No,73.744,15.5739,Economy Family Room,2092
Goa,Chapora Fort,The Grand Chapora Fort Resort & Spa,4.8,2,Yes,Yes,73.739,15.6042,Deluxe King Suite,11343
Goa,Chapora Fort,Chapora Fort Heritage View Hotel,4.3,3,Yes,Yes,73.739,15.6042,Standard Premium Double,5491
Goa,Chapora Fort,Comfort Inn & Suites near Chapora Fort,3.3,4,No,No,73.739,15.6042,Economy Family Room,1742
Goa,Panaji Church,The Grand Panaji Church Resort & Spa,4.7,2,Yes,Yes,73.8278,15.4989,Deluxe King Suite,9935
Goa,Panaji Church,Panaji Church Heritage View Hotel,4.3,3,Yes,No,73.8278,15.4989,Standard Premium Double,5281
Goa,Panaji Church,Comfort Inn & Suites near Panaji Church,3.4,4,No,No,73.8278,15.4989,Economy Family Room,2012
Goa,Colva Beach,The Grand Colva Beach Resort & Spa,4.8,2,Yes,Yes,73.9214,15.2793,Deluxe King Suite,11110
Goa,Colva Beach,Colva Beach Heritage View Hotel,4.0,3,Yes,No,73.9214,15.2793,Standard Premium Double,3766
Goa,Colva Beach,Comfort Inn & Suites near Colva Beach,3.8,4,Yes,No,73.9214,15.2793,Economy Family Room,1589
Goa,Calangute Beach,The Grand Calangute Beach Resort & Spa,4.9,2,Yes,Yes,73.7558,15.5438,Deluxe King Suite,11192
Goa,Calangute Beach,Calangute Beach Heritage View Hotel,3.9,3,Yes,Yes,73.7558,15.5438,Standard Premium Double,3583
Goa,Calangute Beach,Comfort Inn & Suites near Calangute Beach,3.6,4,No,No,73.7558,15.5438,Economy Family Room,1006
Goa,Aguada Fort,The Grand Aguada Fort Resort & Spa,4.8,2,Yes,Yes,73.7737,15.4946,Deluxe King Suite,12574
Goa,Aguada Fort,Aguada Fort Heritage View Hotel,3.9,3,Yes,Yes,73.7737,15.4946,Standard Premium Double,4184
Goa,Aguada Fort,Comfort Inn & Suites near Aguada Fort,3.3,4,Yes,No,73.7737,15.4946,Economy Family Room,2139
Goa,Palolem Beach,The Grand Palolem Beach Resort & Spa,4.7,2,Yes,Yes,74.0234,15.0098,Deluxe King Suite,7428
Goa,Palolem Beach,Palolem Beach Heritage View Hotel,4.3,3,Yes,Yes,74.0234,15.0098,Standard Premium Double,3155
Goa,Palolem Beach,Comfort Inn & Suites near Palolem Beach,3.5,4,No,No,74.0234,15.0098,Economy Family Room,1242
Maharashtra,Gateway of India Mumbai,The Grand Gateway of India Mumbai Resort & Spa,4.7,2,Yes,Yes,72.8347,18.922,Deluxe King Suite,11703
Maharashtra,Gateway of India Mumbai,Gateway of India Mumbai Heritage View Hotel,3.9,3,Yes,Yes,72.8347,18.922,Standard Premium Double,4381
Maharashtra,Gateway of India Mumbai,Comfort Inn & Suites near Gateway of India Mumbai,3.3,4,Yes,No,72.8347,18.922,Economy Family Room,1940
Maharashtra,Ajanta Caves,The Grand Ajanta Caves Resort & Spa,4.8,2,Yes,Yes,75.7033,20.5519,Deluxe King Suite,12120
Maharashtra,Ajanta Caves,Ajanta Caves Heritage View Hotel,3.9,3,Yes,No,75.7033,20.5519,Standard Premium Double,4925
Maharashtra,Ajanta Caves,Comfort Inn & Suites near Ajanta Caves,3.4,4,No,No,75.7033,20.5519,Economy Family Room,931
Maharashtra,Ellora Caves,The Grand Ellora Caves Resort & Spa,4.5,2,Yes,Yes,75.179,20.0258,Deluxe King Suite,8318
Maharashtra,Ellora Caves,Ellora Caves Heritage View Hotel,4.0,3,Yes,No,75.179,20.0258,Standard Premium Double,4970
Maharashtra,Ellora Caves,Comfort Inn & Suites near Ellora Caves,3.4,4,No,No,75.179,20.0258,Economy Family Room,1584
Maharashtra,Elephanta Caves,The Grand Elephanta Caves Resort & Spa,4.8,2,Yes,Yes,72.9315,18.9633,Deluxe King Suite,6849
Maharashtra,Elephanta Caves,Elephanta Caves Heritage View Hotel,4.1,3,Yes,Yes,72.9315,18.9633,Standard Premium Double,3251
Maharashtra,Elephanta Caves,Comfort Inn & Suites near Elephanta Caves,3.4,4,No,No,72.9315,18.9633,Economy Family Room,1110
Maharashtra,Chhatrapati Shivaji Terminus,The Grand Chhatrapati Shivaji Terminus Resort & Spa,4.6,2,Yes,Yes,72.8354,18.94,Deluxe King Suite,14842
Maharashtra,Chhatrapati Shivaji Terminus,Chhatrapati Shivaji Terminus Heritage View Hotel,4.4,3,Yes,Yes,72.8354,18.94,Standard Premium Double,5416
Maharashtra,Chhatrapati Shivaji Terminus,Comfort Inn & Suites near Chhatrapati Shivaji Terminus,3.6,4,Yes,No,72.8354,18.94,Economy Family Room,1106
Maharashtra,Lonavala,The Grand Lonavala Resort & Spa,4.8,2,Yes,Yes,73.4072,18.7481,Deluxe King Suite,14936
Maharashtra,Lonavala,Lonavala Heritage View Hotel,4.2,3,Yes,No,73.4072,18.7481,Standard Premium Double,4336
Maharashtra,Lonavala,Comfort Inn & Suites near Lonavala,3.7,4,No,No,73.4072,18.7481,Economy Family Room,1989
Maharashtra,Mahabaleshwar,The Grand Mahabaleshwar Resort & Spa,4.6,2,Yes,Yes,73.6575,17.9236,Deluxe King Suite,11352
Maharashtra,Mahabaleshwar,Mahabaleshwar Heritage View Hotel,4.3,3,Yes,Yes,73.6575,17.9236,Standard Premium Double,2844
Maharashtra,Mahabaleshwar,Comfort Inn & Suites near Mahabaleshwar,3.8,4,Yes,No,73.6575,17.9236,Economy Family Room,1279
Maharashtra,Shirdi Sai Baba Temple,The Grand Shirdi Sai Baba Temple Resort & Spa,4.7,2,Yes,Yes,74.4768,19.765,Deluxe King Suite,14358
Maharashtra,Shirdi Sai Baba Temple,Shirdi Sai Baba Temple Heritage View Hotel,4.4,3,Yes,No,74.4768,19.765,Standard Premium Double,5103
Maharashtra,Shirdi Sai Baba Temple,Comfort Inn & Suites near Shirdi Sai Baba Temple,3.5,4,Yes,No,74.4768,19.765,Economy Family Room,1366
Maharashtra,Nashik,The Grand Nashik Resort & Spa,4.8,2,Yes,Yes,73.7898,20.0132,Deluxe King Suite,13177
Maharashtra,Nashik,Nashik Heritage View Hotel,4.3,3,Yes,Yes,73.7898,20.0132,Standard Premium Double,5037
Maharashtra,Nashik,Comfort Inn & Suites near Nashik,3.4,4,No,No,73.7898,20.0132,Economy Family Room,2083
Maharashtra,Kolhapur Palace,The Grand Kolhapur Palace Resort & Spa,4.6,2,Yes,Yes,74.2251,16.6949,Deluxe King Suite,10403
Maharashtra,Kolhapur Palace,Kolhapur Palace Heritage View Hotel,4.1,3,Yes,Yes,74.2251,16.6949,Standard Premium Double,2698
Maharashtra,Kolhapur Palace,Comfort Inn & Suites near Kolhapur Palace,3.3,4,No,No,74.2251,16.6949,Economy Family Room,1365
Tamil Nadu,Meenakshi Amman Temple,The Grand Meenakshi Amman Temple Resort & Spa,4.9,2,Yes,Yes,78.1194,9.9195,Deluxe King Suite,14846
Tamil Nadu,Meenakshi Amman Temple,Meenakshi Amman Temple Heritage View Hotel,4.0,3,Yes,No,78.1194,9.9195,Standard Premium Double,5184
Tamil Nadu,Meenakshi Amman Temple,Comfort Inn & Suites near Meenakshi Amman Temple,3.2,4,Yes,No,78.1194,9.9195,Economy Family Room,1283
Tamil Nadu,Shore Temple Mahabalipuram,The Grand Shore Temple Mahabalipuram Resort & Spa,4.9,2,Yes,Yes,80.1928,12.6172,Deluxe King Suite,11438
Tamil Nadu,Shore Temple Mahabalipuram,Shore Temple Mahabalipuram Heritage View Hotel,4.0,3,Yes,Yes,80.1928,12.6172,Standard Premium Double,5061
Tamil Nadu,Shore Temple Mahabalipuram,Comfort Inn & Suites near Shore Temple Mahabalipuram,3.4,4,Yes,No,80.1928,12.6172,Economy Family Room,945
Tamil Nadu,Brihadeeswara Temple Thanjavur,The Grand Brihadeeswara Temple Thanjavur Resort & Spa,4.7,2,Yes,Yes,79.1318,10.7828,Deluxe King Suite,13361
Tamil Nadu,Brihadeeswara Temple Thanjavur,Brihadeeswara Temple Thanjavur Heritage View Hotel,4.2,3,Yes,Yes,79.1318,10.7828,Standard Premium Double,4599
Tamil Nadu,Brihadeeswara Temple Thanjavur,Comfort Inn & Suites near Brihadeeswara Temple Thanjavur,3.5,4,No,No,79.1318,10.7828,Economy Family Room,1357
Tamil Nadu,Ooty,The Grand Ooty Resort & Spa,4.7,2,Yes,Yes,76.695,11.4102,Deluxe King Suite,10852
Tamil Nadu,Ooty,Ooty Heritage View Hotel,4.1,3,Yes,Yes,76.695,11.4102,Standard Premium Double,4913
Tamil Nadu,Ooty,Comfort Inn & Suites near Ooty,3.4,4,Yes,No,76.695,11.4102,Economy Family Room,2178
Tamil Nadu,Kodaikanal,The Grand Kodaikanal Resort & Spa,4.5,2,Yes,Yes,77.4892,10.2381,Deluxe King Suite,8083
Tamil Nadu,Kodaikanal,Kodaikanal Heritage View Hotel,4.3,3,Yes,No,77.4892,10.2381,Standard Premium Double,5250
Tamil Nadu,Kodaikanal,Comfort Inn & Suites near Kodaikanal,3.2,4,No,No,77.4892,10.2381,Economy Family Room,1763
Tamil Nadu,Marina Beach Chennai,The Grand Marina Beach Chennai Resort & Spa,4.9,2,Yes,Yes,80.2824,13.05,Deluxe King Suite,6654
Tamil Nadu,Marina Beach Chennai,Marina Beach Chennai Heritage View Hotel,4.0,3,Yes,Yes,80.2824,13.05,Standard Premium Double,3941
